{
  "$schema": "http://json-schema.org/draft-07/schema#",
  "title": "Tag",
  "type": "object",
  "required": ["tag_id", "name", "level"],
  "properties": {
    "tag_id": { "type": "string" },
    "name": { "type": "string" },
    "level": { "type": "string" },
    "local": { "type": "boolean" },
    "parent_id": { "type": ["string", "null"] },
    "description": { "type": ["string", "null"] }
  }
}
